{
  "case_id": "model.leasev1",
  "code": "accepted",
  "expect": "accepted",
  "model": "LeaseV1",
  "wire": {
    "audio_format": {
      "channels": 1,
      "encoding": "pcm_s16le",
      "sample_rate_hz": 16000
    },
    "audio_origin": "synthetic",
    "epoch": "1",
    "expires_at": "2026-01-01T00:02:00.000Z",
    "input_start_seq": "0",
    "issued_at": "2026-01-01T00:00:00.000Z",
    "lease_id": "00000000-0000-4000-8000-000000000020",
    "message_id": "00000000-0000-4000-8000-000000000001",
    "model_manifest": {
      "model_id": "fixture-asr",
      "provider": "synthetic",
      "revision": "1",
      "sha256": "aaaaaaaaaaaaaaaaaaaaaaaaaaaaaaaaaaaaaaaaaaaaaaaaaaaaaaaaaaaaaaaa"
    },
    "output_start_seq": "0",
    "protocol": "livecho.worker.v1",
    "protocol_minor": 0,
    "revision": "1",
    "room_id": "synthetic-room",
    "sent_at": "2026-01-01T00:00:00.000Z",
    "session_id": "00000000-0000-4000-8000-000000000030",
    "type": "worker.lease"
  }
}
