{
  "case_id": "model.leasecancelv1",
  "code": "accepted",
  "expect": "accepted",
  "model": "LeaseCancelV1",
  "wire": {
    "epoch": "1",
    "expected_revision": "1",
    "lease_id": "00000000-0000-4000-8000-000000000020",
    "message_id": "00000000-0000-4000-8000-000000000001",
    "protocol": "livecho.worker.v1",
    "protocol_minor": 0,
    "reason": "operator_stop",
    "sent_at": "2026-01-01T00:00:00.000Z",
    "session_id": "00000000-0000-4000-8000-000000000030",
    "type": "worker.lease_cancel"
  }
}
