{
  "case_id": "epoch.non_resumed_replacement_clears_state",
  "code": "accepted",
  "expect": "accepted",
  "model": "LeaseReplacementDecisionV1",
  "wire": {
    "current_epoch": "1",
    "replacement_epoch": "2",
    "resumed": false,
    "retained_output_revisions": 0,
    "retained_pcm_bytes": 0,
    "superseded_active_after": false
  }
}
