{
  "case_id": "ack.seq_duplicate",
  "code": "accepted",
  "expect": "accepted",
  "model": "ProtocolAckV1",
  "wire": {
    "acknowledged_message_id": "00000000-0000-4000-8000-000000000002",
    "expected_revision": null,
    "message_id": "00000000-0000-4000-8000-000000000001",
    "outcome": "seq_duplicate",
    "protocol": "livecho.worker.v1",
    "protocol_minor": 0,
    "revision": null,
    "sent_at": "2026-01-01T00:00:00.000Z",
    "seq": "0",
    "type": "protocol.ack"
  }
}
